{
  "$schema": "https://json-schema.org/draft/2020-12/schema",
  "title": "MeshCORE AI-IRB Case",
  "type": "object",
  "required": ["id", "createdAt", "severity", "summary", "evidenceIds", "status"],
  "properties": {
    "id": {"type": "string"},
    "createdAt": {"type": "string"},
    "severity": {"type": "string", "enum": ["LOW", "MEDIUM", "HIGH", "CRITICAL"]},
    "summary": {"type": "string"},
    "status": {"type": "string", "enum": ["OPEN", "IN_REVIEW", "RESOLVED", "ESCALATED"]},
    "affectedSurfaces": {"type": "array", "items": {"type": "string"}},
    "evidenceIds": {"type": "array", "items": {"type": "string"}},
    "links": {"type": "array", "items": {"type": "string"}}
  },
  "additionalProperties": true
}
