{
  "id": "IRB-ba772256",
  "createdAt": "2026-02-18T01:20:08Z",
  "severity": "MEDIUM",
  "summary": "Hourly dogfood: governance engine warm-up",
  "status": "IN_REVIEW",
  "affectedSurfaces": [
    "ops-scripts",
    "governance"
  ],
  "evidenceIds": [
    "20260218T011957Z"
  ],
  "links": []
}
